[
  {
    "evidence_id": "af9690b3-f92",
    "sector": "automotive-car-care",
    "entity_type": "policy",
    "entity_slug": "",
    "query": "\"car care Bangladesh\" regulation Bangladesh 2026",
    "query_family": "policy_tracker",
    "query_score_prior": 0.5,
    "search_provider": "search.datasolved.org",
    "retrieved_at": "2026-05-27T22:50:16.690016+00:00",
    "source_url": "https://www.addressbazar.com/company/auto-car-care",
    "source_domain": "www.addressbazar.com",
    "source_type": "unknown",
    "title": "AutoCarCare|Bangladesh",
    "snippet": "AutoCarCare. Shop-10, 54 Inner Circular Road, Purana Paltan Scout Market +880-2-9330878.We are the best automobile air conditioner service provider fromBangladesh.",
    "extracted_facts": [],
    "source_quality_score": 0.35,
    "recency_score": 1.0,
    "consistency_score": 0.5,
    "confidence_score": 0.545
  },
  {
    "evidence_id": "f98743f1-d5d",
    "sector": "automotive-car-care",
    "entity_type": "policy",
    "entity_slug": "",
    "query": "\"car care Bangladesh\" regulation Bangladesh 2026",
    "query_family": "policy_tracker",
    "query_score_prior": 0.5,
    "search_provider": "search.datasolved.org",
    "retrieved_at": "2026-05-27T22:50:16.690079+00:00",
    "source_url": "https://tahmidurrahman.com/export-import-regulations-bangladesh/",
    "source_domain": "tahmidurrahman.com",
    "source_type": "unknown",
    "title": "Export Import Regulations Bangladesh: A Comprehensive Legal ...",
    "snippet": "May 19,2026·The legal framework surrounding export importregulationsBangladeshcomprises various laws, rules, and guidelines established by the Government ofBangladesh, along with international treaties and agreements. The primary governing bodies include the Ministry of Commerce, theBangladeshCustoms Authority, and the Export Promotion Bureau (EPB).",
    "extracted_facts": [],
    "source_quality_score": 0.35,
    "recency_score": 1.0,
    "consistency_score": 0.5,
    "confidence_score": 0.545
  },
  {
    "evidence_id": "e493595c-73c",
    "sector": "automotive-car-care",
    "entity_type": "policy",
    "entity_slug": "",
    "query": "\"car care Bangladesh\" regulation Bangladesh 2026",
    "query_family": "policy_tracker",
    "query_score_prior": 0.5,
    "search_provider": "search.datasolved.org",
    "retrieved_at": "2026-05-27T22:50:16.690097+00:00",
    "source_url": "https://www.ijfmr.com/publication-archive.php?volume=8&issue=2",
    "source_domain": "www.ijfmr.com",
    "source_type": "unknown",
    "title": "Volume 8, Issue 2 (March-April 2026) - ijfmr.com",
    "snippet": "Call for Paper Volume 8, Issue 3 (May-June2026) Submit your research before last 3 days of June to publish your research paper in the issue of May-June.",
    "extracted_facts": [],
    "source_quality_score": 0.35,
    "recency_score": 1.0,
    "consistency_score": 0.5,
    "confidence_score": 0.545
  },
  {
    "evidence_id": "db2c5565-34b",
    "sector": "automotive-car-care",
    "entity_type": "policy",
    "entity_slug": "",
    "query": "\"car care Bangladesh\" regulation Bangladesh 2026",
    "query_family": "policy_tracker",
    "query_score_prior": 0.5,
    "search_provider": "search.datasolved.org",
    "retrieved_at": "2026-05-27T22:50:16.690118+00:00",
    "source_url": "https://www.tbsnews.net/thoughts/bangladeshs-political-and-economic-transition-laymans-analysis-2026-1375606",
    "source_domain": "www.tbsnews.net",
    "source_type": "unknown",
    "title": "Bangladesh’s political and economic transition: A layman’s ...",
    "snippet": "Mar 2,2026·Bangladeshis at a critical crossroad in2026, as the country prepares for a transformative political transition and faces mounting economic challenges. The general election held early in the year marked a pivotal moment in the nation's history, ushering in a new administration tasked with navigating complex economic realities.",
    "extracted_facts": [],
    "source_quality_score": 0.35,
    "recency_score": 1.0,
    "consistency_score": 0.5,
    "confidence_score": 0.545
  },
  {
    "evidence_id": "e42536e7-9fe",
    "sector": "automotive-car-care",
    "entity_type": "policy",
    "entity_slug": "",
    "query": "\"car care Bangladesh\" regulation Bangladesh 2026",
    "query_family": "policy_tracker",
    "query_score_prior": 0.5,
    "search_provider": "search.datasolved.org",
    "retrieved_at": "2026-05-27T22:50:16.690134+00:00",
    "source_url": "https://www.facebook.com/3M-Car-Care-Bangladesh-102989284931692/",
    "source_domain": "www.facebook.com",
    "source_type": "unknown",
    "title": "Link to facebook.com",
    "snippet": "The site owner hides the web page description.",
    "extracted_facts": [],
    "source_quality_score": 0.35,
    "recency_score": 1.0,
    "consistency_score": 0.5,
    "confidence_score": 0.545
  },
  {
    "evidence_id": "21dfcd68-937",
    "sector": "automotive-car-care",
    "entity_type": "policy",
    "entity_slug": "",
    "query": "\"car care Bangladesh\" policy Bangladesh 2026",
    "query_family": "policy_tracker",
    "query_score_prior": 0.5,
    "search_provider": "search.datasolved.org",
    "retrieved_at": "2026-05-27T22:50:20.631063+00:00",
    "source_url": "https://www.thedailystar.net/business/bangladesh-budget-2026-27",
    "source_domain": "www.thedailystar.net",
    "source_type": "unknown",
    "title": "Bangladesh National Budget 2026–27 | FY27 Budget News ...",
    "snippet": "2 days ago ·Latest updates, analysis, and news on theBangladeshNational Budget2026–27 (FY27), including fiscalpolicy, revenue plans, development spending, and economic impact insights.",
    "extracted_facts": [],
    "source_quality_score": 0.35,
    "recency_score": 1.0,
    "consistency_score": 0.5,
    "confidence_score": 0.545
  },
  {
    "evidence_id": "bee0affc-bc2",
    "sector": "automotive-car-care",
    "entity_type": "policy",
    "entity_slug": "",
    "query": "\"car care Bangladesh\" policy Bangladesh 2026",
    "query_family": "policy_tracker",
    "query_score_prior": 0.5,
    "search_provider": "search.datasolved.org",
    "retrieved_at": "2026-05-27T22:50:20.631103+00:00",
    "source_url": "https://www.tbsnews.net/supplement/turmoil-stability-will-2026-bring-economic-confidence-back-bangladesh-1343826",
    "source_domain": "www.tbsnews.net",
    "source_type": "unknown",
    "title": "Can Bangladesh Regain Economic Confidence in 2026? | The ...",
    "snippet": "Jan 26,2026·Bangladeshenters2026at a crossroads. Stabilisation measures have eased inflation and strengthened reserves, but structural challenges persist. A credible elected government will be key to restoring confidence, unlocking investment, and driving sustainable growth",
    "extracted_facts": [],
    "source_quality_score": 0.35,
    "recency_score": 1.0,
    "consistency_score": 0.5,
    "confidence_score": 0.545
  },
  {
    "evidence_id": "9705b6b7-07c",
    "sector": "automotive-car-care",
    "entity_type": "policy",
    "entity_slug": "",
    "query": "\"car care Bangladesh\" policy Bangladesh 2026",
    "query_family": "policy_tracker",
    "query_score_prior": 0.5,
    "search_provider": "search.datasolved.org",
    "retrieved_at": "2026-05-27T22:50:20.631123+00:00",
    "source_url": "https://www.gov.uk/government/publications/bangladesh-country-policy-and-information-notes",
    "source_domain": "www.gov.uk",
    "source_type": "unknown",
    "title": "Bangladesh: country policy and information notes - GOV.UK",
    "snippet": "Dec 9, 2016 ·Countrypolicyand information note: sexual orientation and gender identity,Bangladesh, April2026PDF, 905 KB, 63 pages This file may not be suitable for users of assistive technology.",
    "extracted_facts": [],
    "source_quality_score": 0.35,
    "recency_score": 1.0,
    "consistency_score": 0.5,
    "confidence_score": 0.545
  },
  {
    "evidence_id": "49bb7b52-5da",
    "sector": "automotive-car-care",
    "entity_type": "policy",
    "entity_slug": "",
    "query": "\"car care Bangladesh\" policy Bangladesh 2026",
    "query_family": "policy_tracker",
    "query_score_prior": 0.5,
    "search_provider": "search.datasolved.org",
    "retrieved_at": "2026-05-27T22:50:20.631179+00:00",
    "source_url": "https://thediplomat.com/2026/03/bangladeshs-political-reset-meets-a-geoeconomic-reckoning/",
    "source_domain": "thediplomat.com",
    "source_type": "unknown",
    "title": "Bangladesh’s Political Reset Meets a Geoeconomic Reckoning",
    "snippet": "Mar 4,2026·Additionally,Bangladesh’s scheduled graduation from the United Nations’ least developed country category to developing country status on November 24,2026makes economic credibility more urgent.",
    "extracted_facts": [],
    "source_quality_score": 0.35,
    "recency_score": 1.0,
    "consistency_score": 0.5,
    "confidence_score": 0.545
  },
  {
    "evidence_id": "d3869e00-ef9",
    "sector": "automotive-car-care",
    "entity_type": "policy",
    "entity_slug": "",
    "query": "\"car care Bangladesh\" policy Bangladesh 2026",
    "query_family": "policy_tracker",
    "query_score_prior": 0.5,
    "search_provider": "search.datasolved.org",
    "retrieved_at": "2026-05-27T22:50:20.631198+00:00",
    "source_url": "https://www.worldbank.org/en/news/press-release/2026/04/08/urgent-reforms-needed-to-restore-macro-stability-sustain-growth-and-create-jobs-in-bangladesh",
    "source_domain": "www.worldbank.org",
    "source_type": "unknown",
    "title": "Urgent Reforms Needed to Restore Macro Stability, Sustain ...",
    "snippet": "Apr 8,2026·The report underscores the need for urgentpolicyand institutional reforms to restore macroeconomic stability, boost revenues, strengthen the financial sector, and improve the business environment so the country can create jobs and stay on the path to inclusive growth. “Resilience has underpinnedBangladesh’s growth story.",
    "extracted_facts": [],
    "source_quality_score": 0.35,
    "recency_score": 1.0,